### ISSUE TITLE
default setting of `proxy_delay` on the bridge setup by shared-vpc-eni plugin causing DNS latency

### ISSUE THREAD

**Issue by M00nF1sh** [aws/amazon-vpc-cni-plugins#78]
### Summary

`shared-vpc-eni` plugin enables [`proxy-arp`](https://github.com/aws/amazon-vpc-cni-plugins/blob/master/plugins/vpc-shared-eni/network/bridge_linux.go#L528) on the bridge, however, the default `proxy_delay`(80) is used, where linux will randomly add delays before respond to ARP request. This can cause significant latency especially in DNS requests if the dns 

### Description

In our environment, we configured pod networking using `shared-vpc-eni` plugin, and pod have a route rule that will route /19 addresses with ARP resolution through the bridge setup by `shared-vpc-eni` plugin. The bridge is now responding the ARP request with a random delay up to 800ms.
```
21:39:35.304307 IP ip-192-168-145-95.us-west-2.compute.internal.54962 > coredns-7b46fbbc79-4t6d8.53: 63137+ [1au] A? tracking.domain.api.int.dev-godaddy.com. (80)
21:39:35.304572 IP coredns-7b46fbbc79-4t6d8.35625 > ip-192-168-0-2.us-west-2.compute.internal.53: 14210+ [1au] A? tracking.domain.api.int.dev-godaddy.com. (80)
21:39:35.304775 IP ip-192-168-0-2.us-west-2.compute.internal.53 > coredns-7b46fbbc79-4t6d8.35625: 14210 NXDomain 0/0/1 (68)
21:39:35.304854 ARP, Request who-has ip-192-168-145-95.us-west-2.compute.internal tell coredns-7b46fbbc79-4t6d8, length 28
21:39:35.623320 ARP, Reply ip-192-168-145-95.us-west-2.compute.internal is-at 06:45:d6:fb:8d:89 (oui Unknown), length 28
21:39:35.623325 IP coredns-7b46fbbc79-4t6d8.53 > ip-192-168-145-95.us-west-2.compute.internal.54962: 63137 NXDomain 0/0/1 (68)
```

* The `proxy_delay` delay is documented in https://man7.org/linux/man-pages/man7/arp.7.html.
* Related kernel code:
  * https://github.com/torvalds/linux/blob/f86d1fbbe7858884d6754534a0afbb74fc30bc26/net/ipv4/arp.c#L871
  * https://github.com/torvalds/linux/blob/4c612826bec1441214816827979b62f84a097e91/net/core/neighbour.c#L1654
To fix it, we should reach out to maintainer of the shared-vpc-eni plugin to disable proxy_delay on the bridge.

e.g. Calico have disabled proxy_delay:
https://github.com/projectcalico/calico/blob/0e9c2865822eb48a7049d1933d37fc0316a9c2aa/cni-plugin/pkg/dataplane/linux/dataplane_linux.go#L394

### Expected Behavior
proxy_delay on the bridge should be 0, since the default delay is not appropriate, i don't think there is a valid use case to have such delay on our bridge

### Observed Behavior
proxy_delay on the bridge is 80

### Environment Details

in an EKS-fargate pod.
